Title,Theme,Description
How to Get Rid of Flies on House Plants,Pest Control,A comprehensive guide on identifying and eliminating flies from your indoor plants effectively
How Often Should You Water House Plants,Plant Care,Discover the best practices for watering house plants including frequency and seasonal adjustments.
Where to Buy House Plants,Shopping,Explore local and online options for purchasing a variety of house plants to enhance your home.
How to Stop Flies in House Plants,Pest Control,Tips and tricks to prevent flies from infesting your house plant ensuring a healthy environment.
What House Plants are Safe for Cats?,Pet Safety,A list of non-toxic house plants that are safe for households with cats ensuring pet safety.
How to Repot House Plants,Plant Care,Step-by-step instructions on how to repot your house plants for optimal growth and health.
How to Keep House Plants Alive in Winter,Seasonal Care,Essential tips for maintaining the health of your house plants during the cold winter months.
What Are the Best House Plants?,Plant Selection,An overview of the best house plants for beginners and seasoned plant enthusiasts alike.
How to Identify House Plants,Plant Identification,A beginner's guide to recognizing different types of house plants and their specific care needs.
When to Start Feeding House Plants,Nutrition Guide,Understand when and how to start fertilizing your house plants for optimal growth.
How to Get Rid of Compost Flies in House Plants,Pest Control,Effective methods for eliminating compost flies from your indoor garden.
How Often Do You Water House Plants?,Plant Care,Detailed insights into watering schedules tailored for different types of house plants.
How to Get Rid of Little Black Flies in House Plants,Pest Control,A practical guide on dealing with small flies that invade your indoor plants.
What House Plants are Poisonous to Cats?,Pet Safety,Critical information on which house plants can be harmful to your feline friends.
How to Look After House Plants,Basic Care,Tips for maintaining healthy house plants through proper care routines.
What Compost is Best for House Plants?,Soil & Fertilization,A discussion on the best compost types for various indoor plants' needs.
How to Water House Plants While Away,Vacation Care,Strategies for keeping your plants hydrated during vacations or extended absences.
How to Get Rid of Fruit Flies in House Plants,Pest Control,Effective techniques for eliminating fruit flies from your indoor garden.
Which House Plants Like Direct Sunlight?,Light Requirements,A guide on selecting house plants that thrive in bright sunlight conditions.
When Should You Repot House Plants?,Repotting Guide,Understanding the signs that indicate it's time to repot your indoor plants.
How Often Should You Feed House Plants?,Nutrition Guide,A detailed look at fertilization schedules for optimal plant health throughout the year.
How to Stop Small Flies in House Plants,Pest Control,Tips and tricks for preventing small flies from invading your indoor garden.
What Are Good Indoor Plants?,Plant Selection,A curated list of popular and easy-to-care-for indoor plant varieties.
How to Clean House Plants,Cleaning Tips,A simple guide on how to keep your house plants clean and dust-free.
Where Can I Buy Cheap House Plants?,Shopping Tips,Advice on finding affordable options for purchasing house plants locally or online.
How to Identify Pests in House Plants,Pest Identification,A guide on recognizing common pests that affect house plants and how to deal with them.
What Are the Benefits of Having Indoor Plants?,Health & Wellness,Exploring the numerous benefits that indoor plants bring to your living space.
How to Care for Succulent House Plants,Specific Plant Care,Tips tailored specifically for caring for succulent varieties indoors.
Which Indoor Plants Improve Air Quality?,Health Benefits,A look at which house plants can help purify the air in your home environment.
How Do I Revive a Dying Plant?,Plant Recovery Techniques,Tips and techniques for bringing back life to struggling house plants.
What Are the Best Low-Light Indoor Plants?,Plant Selection,A selection of indoor plants that thrive in low-light conditions perfect for darker spaces.
When is the Best Time to Water Indoor Plants?,Watering Schedule,A deep dive into understanding optimal watering times based on plant needs and seasons.
How to Propagate Indoor Plants,Propagation Techniques,A step-by-step guide on propagating various types of indoor plants successfully.
What Are Common Mistakes in Plant Care?,Care Tips,A discussion on frequent errors made by plant owners and how to avoid them.
Which Indoor Plants are Toxic to Dogs?,Pet Safety,Critical information regarding which house plants can be harmful to dogs in the household.
How Often Should I Mist My Indoor Plants?,Humidity Needs,Tips on maintaining humidity levels through misting techniques suitable for various plant types.
What Are the Signs of Overwatering Indoor Plants?,Watering Tips,A guide on recognizing overwatering symptoms and how to rectify them promptly.
How Do I Choose the Right Pot for My Plant?,Potting Guide,Tips on selecting appropriate pots based on plant size and type requirements.
Which Indoor Plants Require High Humidity?,Humidity Needs,A selection of indoor plants that thrive in humid environments and tips on maintaining humidity levels.
How to Get Rid of Tiny Black Flies in House Plants,Pest Control,Effective strategies for eliminating tiny black flies that invade your indoor plants.
How to Keep House Plants Watered While on Vacation,Vacation Care,Tips for ensuring your house plants remain hydrated during your time away.
How to Get Rid of Gnats in House Plants,Pest Control,A practical guide to identifying and eliminating gnats from your indoor garden.
What Are the Best House Plants for Beginners?,Plant Selection,An overview of easy-to-care-for house plants perfect for novice plant owners.
How to Identify Pests in Your House Plants,Pest Identification,Learn how to recognize common pests that affect house plants and their signs.
Which House Plants Are Safe for Dogs?,Pet Safety,A list of house plants that are non-toxic and safe for dogs in your home.
How to Stop Little Flies on House Plants,Pest Control,Tips for preventing little flies from becoming a nuisance in your indoor garden.
When is the Best Time to Water House Plants?,Watering Schedule,Guidelines for determining the optimal times to water your house plants.
How to Clean Dust Off House Plants,Cleaning Tips,Simple methods for keeping your house plants clean and free from dust buildup.
What Soil is Best for House Plants?,Soil & Fertilization,A discussion on the ideal soil types for various indoor plants and their needs.
How to Care for Orchid House Plants,Specific Plant Care,Tips specifically tailored for maintaining healthy orchid plants indoors.
What Are Common Signs of Overwatering?,Watering Tips,A guide on recognizing the symptoms of overwatering and how to fix them.
How Often Should You Feed House Plants?,Nutrition Guide,Understanding fertilization schedules and when to feed different types of house plants.
How to Get Rid of Fruit Flies in House Plants,Pest Control,Effective methods for eliminating fruit flies that infest your indoor plants.
Which Indoor Plants Thrive in Low Light?,Plant Selection,A list of house plants that do well in low-light environments perfect for darker spaces.
How to Propagate Your House Plants,Propagation Techniques,A step-by-step guide on propagating popular indoor plants successfully.
What Are the Benefits of Indoor Plants?,Health & Wellness,Exploring the numerous health benefits that having indoor plants can provide.
How to Revive a Wilting Plant,Plant Recovery Techniques,Tips and techniques for bringing back life to struggling or wilting house plants.
What Are Good Indoor Plants for Air Quality?,Health Benefits,A look at which house plants can help improve air quality in your home environment.
When Should You Repot Your House Plants?,Repotting Guide,Understanding the signs that indicate it's time to repot your indoor plants.
How to Deal with Moldy Soil in House Plants,Soil Care,Tips on preventing and treating mold growth in potting soil for house plants.
Which House Plants Absorb Moisture?,Humidity Needs,A selection of indoor plants known for their moisture-absorbing properties beneficial in humid climates.
How to Get Rid of Tiny Flies in House Plants,Pest Control,Effective strategies for eliminating tiny flies that invade your indoor plants.
How to Keep House Plants Watered While on Vacation,Vacation Care,Tips for ensuring your house plants remain hydrated during your time away.
How to Get Rid of Gnats in House Plants,Pest Control,A practical guide to identifying and eliminating gnats from your indoor garden.
What Are the Best House Plants for Beginners?,Plant Selection,An overview of easy-to-care-for house plants perfect for novice plant owners.
How to Identify Pests in Your House Plants,Pest Identification,Learn how to recognize common pests that affect house plants and their signs.
Which House Plants Are Safe for Dogs?,Pet Safety,A list of house plants that are non-toxic and safe for dogs in your home.
How to Stop Little Flies on House Plants,Pest Control,Tips for preventing little flies from becoming a nuisance in your indoor garden.
When is the Best Time to Water House Plants?,Watering Schedule,Guidelines for determining the optimal times to water your house plants.
How to Clean Dust Off House Plants,Cleaning Tips,Simple methods for keeping your house plants clean and free from dust buildup.
What Soil is Best for House Plants?,Soil & Fertilization,A discussion on the ideal soil types for various indoor plants and their needs.
How to Care for Orchid House Plants,Specific Plant Care,Tips specifically tailored for maintaining healthy orchid plants indoors.
What Are Common Signs of Overwatering?,Watering Tips,A guide on recognizing the symptoms of overwatering and how to fix them.
How Often Should You Feed House Plants?,Nutrition Guide,Understanding fertilization schedules and when to feed different types of house plants.
How to Get Rid of Fruit Flies in House Plants,Pest Control,Effective methods for eliminating fruit flies that infest your indoor plants.
Which Indoor Plants Thrive in Low Light?,Plant Selection,A list of house plants that do well in low-light environments perfect for darker spaces.
How to Propagate Your House Plants,Propagation Techniques,A step-by-step guide on propagating popular indoor plants successfully.
What Are the Benefits of Indoor Plants?,Health & Wellness,Exploring the numerous health benefits that having indoor plants can provide.
How to Revive a Wilting Plant,Plant Recovery Techniques,Tips and techniques for bringing back life to struggling or wilting house plants.
What Are Good Indoor Plants for Air Quality?,Health Benefits,A look at which house plants can help improve air quality in your home environment.
When Should You Repot Your House Plants?,Repotting Guide,Understanding the signs that indicate it's time to repot your indoor plants.
How to Deal with Moldy Soil in House Plants,Soil Care,Tips on preventing and treating mold growth in potting soil for house plants.
Which House Plants Absorb Moisture?,Humidity Needs,A selection of indoor plants known for their moisture-absorbing properties beneficial in humid climates.
How Often Should You Water House Plants in Winter?,Watering Schedule,Tips on adjusting watering practices during the colder months for optimal plant health.
What Are the Best Indoor Plants for Beginners?,Plant Selection,A curated list of beginner-friendly indoor plants that are easy to care for and maintain.
How to Choose the Right Pot for Your Plant?,Potting Guide,Tips on selecting appropriate pots based on plant size and type requirements.
How Do I Know If My Plant Needs Water?,Watering Tips,A guide on recognizing signs that indicate when your house plant needs watering.
What Are the Signs of a Healthy Plant?,Plant Health,A discussion on identifying key indicators of plant health and vitality.
How to Fertilize Your Indoor Plants,Nutrition Guide,Best practices for fertilizing various types of indoor plants effectively.
What Are Common Mistakes in Plant Care?,Care Tips,A discussion on frequent errors made by plant owners and how to avoid them.
Which Indoor Plants Improve Air Quality?,Health Benefits,A look at which house plants can help purify the air in your home environment.
How to Identify Common House Plant Pests,Pest Identification,A guide to recognizing and dealing with common pests that affect house plants.
How to Create a Plant Care Schedule,Plant Care,Tips for developing a personalized care routine for your indoor plants.
What House Plants Are Best for Air Purification?,Health Benefits,Exploring the top house plants known for their air-purifying qualities.
How to Use Coffee Grounds for House Plants,Nutrition Guide,Learn how to use coffee grounds as a natural fertilizer for your indoor plants.
What Are the Signs of a Healthy House Plant?,Plant Health,Key indicators to help you determine if your house plants are thriving.
How to Choose the Right Watering Can for House Plants,Watering Tips,A guide on selecting the best watering can to suit your indoor gardening needs.
How to Make Your Own Potting Mix,Soil & Fertilization,A step-by-step guide to creating a custom potting mix for your house plants.
What Plants Can Help Reduce Stress?,Health Benefits,Discussing house plants that can contribute to a calming home environment.
How to Keep Your House Plants Free of Dust,Cleaning Tips,Effective methods for keeping your indoor plants clean and dust-free.
When is the Best Time to Fertilize House Plants?,Nutrition Guide,Tips on timing your fertilization for optimal plant growth throughout the year.
How to Deal with Root Rot in House Plants,Plant Recovery Techniques,Identifying root rot and steps to save affected plants.
Which Indoor Plants Are Best for Beginners?,Plant Selection,A curated list of low-maintenance house plants ideal for novice gardeners.
How to Create a Terrarium at Home,DIY Projects,A fun guide on making your own terrarium with suitable house plants.
What Are the Best Indoor Plants for Low Light?,Plant Selection,A selection of house plants that thrive in low-light conditions perfect for darker spaces.
How to Train Your House Plants to Grow Upwards,Growing Techniques,Tips on encouraging climbing or trailing plants to grow vertically.
What Are the Benefits of Having Plants in Your Bedroom?,Health Benefits,Exploring how indoor plants can improve sleep quality and air quality in bedrooms.
How to Use Essential Oils for Plant Care,Natural Remedies,A guide on using essential oils as natural pest deterrents and plant care aids.
Which House Plants Are Best for Humid Environments?,Plant Selection,A look at house plants that thrive in high humidity settings like bathrooms or kitchens.
How to Keep Your House Plants Alive During Summer Heat,Seasonal Care,Tips for protecting your indoor plants from extreme heat during summer months.
What Are the Most Popular Indoor Plants Right Now?,Trends in Plant Care,A roundup of trending house plants that are currently popular among plant enthusiasts.
How to Make Your Own Organic Fertilizer,Nutrition Guide,A guide on creating homemade organic fertilizers using kitchen scraps and natural ingredients.


